"Story","Title","Result","Date","Stability","Duration (s)"
"Collections test","Podam should be able to create instances of Concurrent Hash Maps","SUCCESS","2016-08-21T23:35:43.992+07:00","0.0","0.04"
"Collections test","Podam should be able to create instances of Hash Maps","SUCCESS","2016-08-21T23:35:44.082+07:00","0.0","0.08"
"Collections test","Podam should be able to create instances of Sorted Maps","SUCCESS","2016-08-21T23:35:43.637+07:00","0.0","0.04"
"Collections test","Podam should be able to fill in POJOs with raw type collection attributes and default values to Object","SUCCESS","2016-08-21T23:35:43.590+07:00","0.0","0.05"
"Collections test","Podam should fill in POJOs with attributes containing wildcards","SUCCESS","2016-08-21T23:35:44.166+07:00","0.0","0.03"
"Collections test","Podam should handle POJOs with no setters and collections in the constructor","SUCCESS","2016-08-21T23:35:43.880+07:00","0.0","0.04"
"Collections test","Podam should handle immutable POJOs with generified collections in the constructor","SUCCESS","2016-08-21T23:35:43.918+07:00","0.0","0.07"
"Collections test","Podam should handle immutable Pojos with non generic collections","SUCCESS","2016-08-21T23:35:44.035+07:00","0.0","0.05"
"Collections test","Podam should handle standard collections","SUCCESS","2016-08-21T23:35:43.682+07:00","0.0","0.2"
