"Story","Title","Result","Date","Stability","Duration (s)"
"Multiple interfaces inheritance test","Podam cannot instantiate interfaces","SUCCESS","2016-09-03T17:53:02.569+01:00","0.0","0.0"
"Multiple interfaces inheritance test","Podam cannot instantiate interfaces which extend Map","SUCCESS","2016-09-03T17:53:02.561+01:00","0.0","0.0"
"Inheritance test","Podam should handle basic inheritance scenarios","SUCCESS","2016-09-03T17:53:02.530+01:00","0.0","0.01"
"Inheritance test","Podam should handle the manufacturing of POJOs which inherit from other classes","SUCCESS","2016-09-03T17:53:02.544+01:00","0.0","0.0"
"Inheritance test","Podam should manufacture all POJOs in a tree hierarchy","SUCCESS","2016-09-03T17:53:02.539+01:00","0.0","0.0"
"Inheritance test","Podam should manufacture attributes implementing Collection and Map interfaces","SUCCESS","2016-09-03T17:53:02.522+01:00","0.0","0.01"
"Multiple interfaces inheritance test","Podam will create an instance of a POJO but its interface types won't be instantiated","SUCCESS","2016-09-03T17:53:02.565+01:00","0.0","0.0"
