"Story","Title","Result","Date","Stability","Duration (s)"
"Multiple interfaces inheritance test","Podam cannot instantiate interfaces","SUCCESS","2023-07-29T17:16:39.614+03:00","0.0","0.12"
"Multiple interfaces inheritance test","Podam cannot instantiate interfaces which extend Map","SUCCESS","2023-07-29T17:16:39.366+03:00","0.0","0.13"
"Inheritance test","Podam should handle basic inheritance scenarios","SUCCESS","2023-07-29T17:16:38.992+03:00","0.0","0.13"
"Inheritance test","Podam should handle the manufacturing of POJOs which inherit from other classes","SUCCESS","2023-07-29T17:16:39.244+03:00","0.0","0.11"
"Inheritance test","Podam should manufacture all POJOs in a tree hierarchy","SUCCESS","2023-07-29T17:16:39.124+03:00","0.0","0.12"
"Inheritance test","Podam should manufacture attributes implementing Collection and Map interfaces","SUCCESS","2023-07-29T17:16:38.859+03:00","0.0","0.13"
"Multiple interfaces inheritance test","Podam will create an instance of a POJO but its interface types won't be instantiated","SUCCESS","2023-07-29T17:16:39.499+03:00","0.0","0.12"
